"asin","title"
"B0000537KC","Genisoy Soy Protein Bars, Chocolate Fudge Brownie, 1.98-Ounce Bars 12-Count Boxes"
"B0000CEQD5","MaraNatha Organic No Stir Creamy Peanut Butter -- 16 oz"
"B0001VU7TC","Nature's Plus - Algae Max, 500 mg, 90 tablets"
"B00028PVHW","Vege-Sal Spike Natural Seasoning Original VEGESAL 10 oz (283gr)"
"B00028QD2Y","Spike Vege-Sal Magic Gaylord Hauser 20 oz Salt"
"B0002DI23C","Bark Bars Peanut Butter Crunch Pet Treat, 12-Ounce"
"B00032CV8O","Goya Mojo Criollo Marinade, 24-Ounce Bottle (Pack of 2)"
"B0005YLO6U","Goya Sazon with Coriander and Annatto - 3.52 oz. box, 18 per case"
"B0005YWXQU","Goya Sazon Azafran Seasoning (1.40z)"
"B00060N592","Maranatha Pnut Btr, Og, Crmy, Salt, 16-Ounce"
"B0007LXU0E","Kashi Tlc Chewy Granola Bar, Trail Mix, 7.4-Ounce Packages (Pack of 6)"
"B0007LXU0Y","Kashi TLC Chewy Granola Bar, Peanut Peanut Butter, 6-Count Bars(Pack of 6)"
"B000B8PZAQ","Big Train Chai - No Sugar Added Vanilla Chai (3.5 lb Bulk Bag)"
"B000B8SR8I","Big Train Vanilla Chai Latte, 3.5lb. Bag"
"B000CS9ZUG","Kellogg's Cereal Variety Pack, Single Serve Boxes (Pack of 72)"
"B000CSCP1C","Kellogg's Cereal Family Variety Pack, Single Serve Bowls, (Pack of 96)"
"B000DZDJ0K","Pamela's Products Ultimate Baking &amp; Pancake Mix, 24-Ounce Packages (Pack of 6)"
"B000F6SLM8","Betty Lou's Peanut Butter Nut Butter Balls, Gluten Free, 1.75-Ounce Packages (Pack of 18)"
"B000FDCVOK","Sylvia's Rib Rub 'N More Seasoning, 5.5-Ounce Containers (Pack of 12)"
"B000FEDHXI","Reese Medium Smoked Oysters, 3.7-Ounce, 10-Count Cans"
"B000FEDHS8","Reese Petite Smoked Oysters, 3.7-Ounce, 10-Count Cans"
"B000FEH73E","Reese Colossal Smoked Oysters, 3.7-Ounce Cans (Pack of 10)"
"B000G1EO64","Amy's Light in Sodium Organic Lentil Soup, 14.5-Ounce Cans (Pack of 12)"
"B000H23Z1C","Carroll Shelby's Original Texas Chili Kit, 4 oz Boxes, 12 pk"
"B000H2998U","Wick Fowler's Products 2-Alarm Chili Kit, 3.625-Ounce Boxes (Pack of 12)"
"B000HDJZWO","Enjoy Life Semi-Sweet Chocolate Chips, Gluten, Dairy, nut &amp; Soy Free, Mini Chips, 10-Ounce Bags (Pack of 6)"
"B000HQKO1W","Goya Sazon Achiote, 12-Count Package (Pack of 24)"
"B000IEHQV4","Klein's Naturals Pistachios, Salted, In Shell, (Pack of 6)"
"B000LKU874","Simply Organic Sweet Basil Pesto, Seasoning Mix, Certified Organic, 0.53-Ounce Packets (Pack of 12)"
"B000LKU8A6","Simply Organic Alfredo, Seasoning Mix, Certified Organic, 1.48-Ounce Packets (Pack of 12)"
"B000LKXOKC","Simply Organic Fajita, Seasoning Mix, Certified Organic, 1-Ounce Packets (Pack of 12)"
"B000LKYXUC","Vege-Sal Vegetized Seasoning Salt, 4-Ounce Shaker (Pack of 6)"
"B000LKYX48","Food For Life Ezekiel 4:9 Organic Sprouted Grain Cereal, Golden Flax, 16-Ounce Boxes (Pack of 6)"
"B000LKZI1U","Simply Organic Spicy Chili, Seasoning Mix, Certified Organic, 1-Ounce Packets (Pack of 12)"
"B000LKZI2O","Simply Organic Veggie Chili, Seasoning Mix, Certified Organic, 1-Ounce Packets (Pack of 12)"
"B000LL0R92","Vita Coco Coconut Water with Peach &amp; Mango, 11.1-Ounces Containers (Pack of 12)"
"B000PXZZQG","Kraft Macaroni &amp; Cheese 7.25 oz (Pack of 35)"
"B000Q61NYA","Chiclets Gum (2-piece per package), 200-Count Packages"
"B000UCOQV2","Golden Barrel Blackstrap Molasses - 16 fl oz (single)"
"B000UUWECC","O.N.E. Coconut Water, 11.2-Ounce Aseptic Containers (Pack of 12)"
"B000UYC36U","Frontier Bulk Ranch Dip/Dressing mix, CERTIFIED ORGANIC, 1 lb. package"
"B000UYC3CO","Frontier Natural Products Organic Broth Powder Vegetable Flavored -- 16 oz"
"B000VK4F00","Simply Organic Vegetarian Brown Gravy, Seasoning Mix, Certified Organic, 1-Ounce Packets (Pack of 12)"
"B000WR8UDU","Simply Organic Fish Taco Seasoning (12x1.13Oz)"
"B000WS042E","Simply Organic Creamy Dill Dip Mix -- 0.7 oz"
"B000Z8Z6W4","Spike Vegit Magic Gourmet Natural Seasoning, 1 X 4 Ounce Box"
"B0011DHFE4","Woodstock Farms Organic Campfire Trail Mix ( 12 OZ)"
"B0012690UC","Szeged Hungarian Paprika, Sweet, 5 Ounce"
"B0017T6RZK","Rub with Love Ancho &amp; Molasses Barbecue Sauce by Tom Douglas,  16-Ounce"
"B0019LWITA","Lundberg Organic Brown Rice Flour, 25-Pound"
"B001BF5KVW","Lucky Country Aussie Style Soft Licorice, Black, 1.5 Pound"
"B001BKRC6S","Spike Seasoning Hot and Spicy Gaylord Hauser 2.5 oz Shaker"
"B001DGYKG0","NuGo Dark, Chocolate Chocolate Chip, Dairy Free, 1.76-Ounce Bars (Pack of 12)"
"B001E4Q5WI","Skippy Peanut Butter, Reduced Fat Creamy, 16.3-Ounce Jars (Pack of 6)"
"B001EO5YCA","Nature's Path Organic Peanut Butter  Granola Cereal, 11.5-Ounce Box (Pack of 6)"
"B001EQ4GOA","Planters Pistachio Lovers Mix, 6-Ounce Canisters (Pack of 6)"
"B001G7FMLS","Nabisco Nutter Butter Bites, 3-Ounces (Pack Of 12)"
"B001GVISNS","Goya Sazon Goya Cilantro &amp; Annantto, 3.52-Ounce Units (Pack of 6)"
"B001HTE0J0","Ah!Laska Organic Non-Dairy Cocoa Mix ( 12x12 OZ)"
"B001HTGAUM","Nature's Path Organic Granola Bars, Peanut Choco', 5-Count Boxes, 1.2oz,  (Pack of 6)"
"B001HTGAQQ","EnviroKidz Organic Lemur Peanut Choco Drizzle Crispy Rice Bar, 6-Count Bars, 6oz Boxes(Pack of 6)"
"B001HTIVX6","Sweet Leaf Tea Organic Mint and Honey Green Tea, 16 Ounce -- 12 per case."
"B001HTJ2BQ","Native Forest Organic Classic Coconut Milk, 13.5-Ounce Cans (Pack of 12)"
"B001HTL5E8","Nugo Nutrition Bar Dark Chocolate Chocolate Chip Bar ( 12x50 GM)"
"B001HTN41A","Nugo Dark Mocha Chocolate Nutrition Bar, 5 Gram -- 12 per case."
"B001KPB2RY","Pamela's Products Gluten and Wheat Free Cookies Peanut Butter Chocolate Chip -- 5.29 oz"
"B001KWGSEY","Chunks Carob Hawaiian Spirulina (1x10LB)"
"B001M073SO","Goya Sazon Jumbo Pack, 6.33-Ounce Packages (Pack of 3)"
"B001SAOB42","Sunridge Farms Trail Mix, Hit the Trail, 25-Pound"
"B001V74HAK","Kelloggs Frosted Whole Grain Mini Wheats, 70-Ounce"
"B001VNGMDE","Frontier Garlic Powder Certified Organic, 16 Ounce Bag"
"B001VNO3B2","Frontier Vegetarian Broth Powder, Certified Organic, 16 Ounce Bag"
"B001XWN3IA","Simply Organic Italian Herb Spag Sauce Certified Organic, 1.31-Ounce Packets (Pack of 12)"
"B0027YUN9K","Go Raw Freeland Live Sprouted Seeds with Celtic Sea Salt, Spicy, 1 lb. Bag (Pack of 2)"
"B0028MDH30","Saucy Mama Lime Chipotle Marinade, 12-Ounce Boxes (Pack of 6)"
"B0028MFES6","Sunland Banana Peanut Butter Spread (No Stir), 16-Ounce PET Jars (Pack of 6)"
"B0028MZ8S2","Sunland Valencia Peanut Butter Crunchy, No Stir, 16-Ounce PET Jar (Pack of 4)"
"B0029JX426","Mrs. Fields Individually Wrapped White Chunk Macadamia Cookies (2.1 oz./ Pack of 12)"
"B002ATEFMI","SCNS Sports Foods 10th Tee Peanut Honey Back Nine Golf Energy Bar, 1.76-Ounce Bars (Pack of 12)"
"B002DHOVPS","Corn Pops Cereal, 12.5-Ounce Packages (Pack of 4)"
"B002GVK07O","Chobani, Peach Non Fat Greek Yogurt, 6 oz"
"B002HTMAXM","Amy's Spinach Pizza, 14 oz (Frozen)"
"B002HTMEPQ","Amy's Tofu Scramble Organic, 9-Ounce Boxes (Pack of 12)"
"B002HTOCRE","Amy's Enchilada Verde Whole Meal, 10-Ounce Boxes (Pack of 12)"
"B002LO5SFA","Spike Seasoning Gaylord Hauser 14oz Packet"
"B0030VBQGS","Happy Baby Organic Baby Food 1 Starting Solids, Fresh Mango, 3.5-Ounce (Pack of 16)"
"B0030VBQOK","Happy Baby Organic Baby Food 2 Simple Combos, Apricot and Sweet Potato, 3.5-Ounce Pouches (Pack of 16)"
"B0030VBPN2","Happy Tot Organic Baby Food, Sweet Potato, Apple, Carrot and Cinnamon, 4.22-Ounce Pouches (Pack of 16)"
"B0030VJ79Q","Happy Tot Organic Baby Food, Stage 4.22 Ounce, Spinach, Mango and Pear, 4.22-Ounce Pouches (Pack of 16)"
"B0035HCRRY","Archer Farms Heart Healthy roasted Pistachios Salted 24 oz"
"B0036ADF2G","Happybaby Happy Tots - Green Beans Pears and Peas Organic Baby Super Food for Kids - 4.22 Oz pouch"
"B0036FB6FY","Nature's Earthly Choice: Organic Quinoa (1 x 4 lbs)"
"B0036WC6QA","Chiclets Gum, Peppermint,12-Piece Packages (Pack of 120)"
"B003BHA6PI","Martin's Potato Rolls 8 Sandwich Rolls Pack of 4"
"B003D54TEW","Jack Links Pepperoni Beef Sticks, 7.2 -Ounce Bags (Pack of 3)"
"B003FCZOPQ","Natural Vines Black Licorice, 8-Ounce Bags (Pack of 6)"
"B003HASJ6W","Gluten-Free Naturals Pancake Mix, 12.6-Ounce Bags (Pack of 6)"
"B003O36S9W","Lifestyle Evolution {Nugo} Bar, Nugo, Free, Drk Trl Mix, 45-grams (Pack of 12)"
"B003T07T7U","Badia Spices inc Spice, Cumin Seed Ground, 16-Ounce"
"B003TVO3BE","Allegro Original Marinade the Flavorizer that Tenderizes - 12.7 oz"
"B003XB5LMU","Coconut Secret Raw Organic Vegan Coconut Aminos 8 Fl Oz"
"B003YCJE2Q","Planters Pistachio Lovers Mix 21 Ounce Can"
"B0040HASFQ","Kraft, Velveeta Shells &amp; Cheese, Original Microwave Cups, 2.39oz Each Cup, 9.56oz Per Package (Pack of 6)"
"B0041Q7GDI","Spike Seasoning - 7 oz - Packet"
"B0042DIZIU","Wonderful Pistachios Roasted and Salted Pistachios, 36 Ounce, Pack of 24"
"B00449CWMC","Joseph's Peanut Butter, Salt-free, No Sugar Added, Creamy, 18 Oz."
"B00451XODA","Badia Spices Cumin Ground, 7-Ounce (Pack of 6)"
"B0046IIIS8","Maranatha Natural Foods 12 Oz Crunchy Almond Butter No Stir"
"B0046IKGKQ","Maranatha Creamy Almond Butter, 16 Ounce"
"B00474CIGY","Alba Low Fat Snack Shake Mix Double Fudge Royale, 8-Count, 6-Ounce Box (Pack of 3)"
"B00495RQNG","Genesis Today Goji Berry Juice -- 32 fl oz"
"B004DEDZ2E","Planters Peanuts Honey Roasted, 6-Ounce (Pack of 12)"
"B004F4GH5E","Justin`s Milk Chocolate P/Butter Milk Cups ( 12/1.4 OZ)"
"B004FUHGWQ","Sweetleaft Half&amp;Half Tea-Lemondade(95% Organic), 16-Ounce Glass(Pack of 12)"
"B004HZFASG","Roasted &amp; Salted Pistacios 24 OZ"
"B004M8DPQW","Gaylord Hauser Spike Seasoning, 3-Ounce (Pack of 6)"
"B004NQWALO","Modern Products Spike Seasoning Bulk , 5 pound -- 1 each"
"B004OEYC3Y","Braga Organic Farms Kernels Pistachios, Raw, 2 Pound"
"B004UB6YLO","Modern Products Hauser Vegetable Broth 4 oz."
"B004V6A9SC","Newman's Own Con Queso Salsa, 16-Ounce (Pack of 6)"
"B004WZ4FEQ","Zing Cashew Cranberry Orange Gluten Free Bars, 1.76-Ounce (Pack of 6)"
"B004WZ4EWE","Zing Dark Chocolate Coconut Gluten Free Bars, 1.76-Ounce (Pack of 6)"
"B004YLD7SS","Setton Farms Premium Pistachios Roasted Salted - 32 Oz"
"B004YLD7LA","Setton Farms Premium Pistachios Roasted Unsalted - 1 Pound"
"B0052P1PPW","Simply Organic Dips Ranch At least 95% Organic (12x1.5oz)"
"B0052P1PBQ","Simply Organic Dip Mix, French Onion, 1.1 Ounce (Pack of 12)"
"B00555H0LC","Justin's Nut Butter - Hazelnut Butter Blend Chocolate - 16 oz."
"B0059HMM3M","Chicken Of The Sea albacore tuna in water, solid white, 7-oz 8 pk Cans"
"B005KDP4FI","Almond Butter with Flaxseed, 16 oz"
"B005L9175C","Sazon Goya con Culantro y Achiote 3.52 oz - Low Sodium Seasoning (2 pack)"
"B005M4AM5M","Justin's Dark Choc P/Butter Milk Cups (12x1.4 Oz)"
"B005MHRB7G","Plum Organics Baby Second Blends, Spinach, Peas and Pear, 4.0-Ounce Pouches (Pack of 12)"
"B005MHRE14","Plum Organics Baby Second Blends, Peach, Apricot and Banana, 4.0-Ounce Pouches (Pack of 12)"
"B005MHRF86","Plum Organics Baby Second Blends, Apple and Carrot, 4.0-Ounce Pouches (Pack of 12)"
"B005MYWWN2","Kraft, Macaroni &amp; Cheese Dinner, Original, Shrink Wrap Pack of 5, 2lbs 4.25oz Box"
"B005P0G0YU","Modern Products Spike Vegit Magic! Gourmet Natural Seasoning -- 2 oz"
"B005P0XO26","Modern Products - Spike Gourmet Natural Seasoning Tenderizer Magic - 3.75 oz."
"B005PGP2B6","Frontier Herb Curry Powder (1X1lb)"
"B005TY2046","Enjoy Life Foods Semi-Sweet Chocolate Chips Gluten Free (3x10 OZ)"
"B005Z0TMCM","Nature Valley Sweet &amp; Salty Almond Granola Bars 7.4 oz"
"B00651OEHS","Arm &amp; Hammer Baking Soda, 8 Ounce (Pack of 24)"
"B0067F1T48","NuttZo Original CRUNCHY PET JARS (BPA FREE) (2 JARS)"
"B0069A8X2C","Man Bait- Maple Bacon Lollipops- Sampler Gift Pack of 10"
"B006DVPZSW","Szeged Fish Rub 5 oz."
"B006JGHMX2","Oskri Fig Bar with Dark Chocolate, 1.9-Ounce (Pack of 20)"
"B006R21JQE","Newman's Own Organics Peanut Butter O's, Organic 8 oz. (Pack of 6)"
"B006R7F0PU","Justin's Nut Butter Maple Almond 16oz Jar"
"B006U2ZDAE","Better Batter Pancake and Biscuit Mix Gluten Free -- 20 oz"
"B006U3BEEW","Better Batter Cake Mix Gluten Free Chocolate -- 18.25 oz"
"B006U3ETB2","Better Batter Gluten Free Yellow Cake Mix -- 18.25oz"
"B006WX7Z7U","Blue Plate Light Mayonnaise Squeeze, 18-Ounce (Pack of 6)"
"B0073O797I","Plum Organics Second Blends, Raspberry, Spinach and Greek Yogurt, 4-Ounce (Pack of 6)"
"B007MEXS7E","Trader Joes Gluten Free Crispy Crunchy Chocolate Chip Cookies, 2 Packs"
"B007WP3WOW","Plum Organics Baby Second Blends Fruit and Grain, Sweet Potato Mango and Millet, 3.5-Ounce (Pack of 12)"
"B007WP3J8G","Plum Organics Baby Second Blends Fruit and Grain , Plum Berry and Barley, 3.5-Ounce (Pack of 12)"
"B0081RNC4A","Kelloggs Variety Cereal, 31.37-Ounce"
"B00832T6MA","TRADER JOE'S Spreadable Creamed Clover Honey - 2 PACKS"
"B0083GG2SC","Capri Sun Variety Pack Juice Pouches, Fruit Punch, Strawberry, Kiwi, Wild Cherry and Pacific Cooler, 6 FL OZ (40 Count)"
"B00868Y8TM","Nature's Earthly Choice All Natural Rice, Black, 14 Ounce"
"B0087ENBS4","Jones' Organic Mock Salt - Salt Free Seasoning-1.6 oz."
"B0087ENBHU","Jones Spicy Southwest Blend Mock Salt-1.6 oz"
"B00886PPFS","Plum Kids Organic Fruit and Veggie Mashups, Blueberry Blitz, 3.17 Ounce, 4-Count (Pack of 6)"
"B008BRLNAA","Goya Foods Sazon Culantro y Achiote, 1.41-Ounce"
"B008N1LT94","Zing Dark Chocolate Hazelnut Bar, 1.76 Ounce (Pack of 12)"
"B008QPAH40","Nabisco belVita Chocolate Breakfast Biscuits, 1.76 Ounce (Pack of 4)"
"B008QR77KU","Hawaiian, Sweet Maui Onion Rings, Crispy Golden Rings, 4oz Bag (Pack of 3)"
"B008XDLLLS","Orrfar: Soup, Base, Beef, Low Sod, 5 OZ"
"B008YAYWLQ","Sunbird Stir Fry Mix (12x0.75OZ )"
"B009OAIWMA","Simply Organic Salad Dressing Mix, Classic Caesar,  (Pack of 12)"
"B009OAJ4UE","Simply Organic Dip Mix, Guacamole, Pack of 12"
"B009ORZGUE","Archer Farms Tex Mex Trail Mix - 26 Oz Jar"
"B00ARHGO88","Popcorn Indiana Gourmet Age White Cheddar Popcorn .8oz Bags/48pack"
"B00AX89ODS","Naturally More, Peanut Butter with Omega-3 &amp; Flax Seed, 16oz Jar (Pack of 3)"
"B00B03WZIQ","Rudis Organic Multigrain Oat Sandwich Bread, 22 Ounce -- 8 per case."
"B00B044BNW","Kellogg's Frosted Mini Wheats Bite Size, 24 Ounce Box"
"B00B0476HA","Pepsico Aunt Jemima White Corn Meal Mix, 5 Pound -- 8 per case."
"B00B05XYTI","Justin's Nut Butter Honey Peanut Butter Squeeze Packs, 1.15 Oz. (Pack of 20)"
"B00B1F3YLA","Lesserevil Chia Crisps Baked Crunchy Black Bean Chips Crunchy Dill Pickle -- 4 oz"
"B00BKXGX5W","Joy Luck Star Anise, 2 Ounce (Pack of 50)"
"B00BLZUP9E","Next by Nature Dark Chocolate, Cherries, 3 Ounce (Pack of 12)"
"B00BTKZP96","General Mills Cheerios, Honey Nut 2 Bags, 55 Ounce"
"B00CA5S4K6","ICE Chips Fruity Variety Pack - SIX 50g (1.76 oz)Full-size Tins in Most Popular Flavors"
"B00CFQNVC6","Special K Cereal, Red Berries 37 Oz (Pack of 2)"
"B00CHTYN64","Frontier Herb Organic All Purpose Mama Garlic - Seasoning Salt Blend, 5 Ounce -- 6 per case"
"B00CK7SZN0","Wonderful Pistachios, 5 Ounce"
"B00CPJB9OA","Joseph's Peanut Butter, Salt-free, No Sugar Added, Crunchy, 18 Oz."
"B00CQABEQG","Tate's Bake Shop All Natural Chocolate Chip Cookies 7oz (Pack of 3)"
"B00CTJ2710","Skinny Pop Popcorn, 6 Count"
"B00CVY459K","Arm &amp; Hammer Pure Baking Soda 1lb 2pack"
"B00CXYIS1Y","Tully's Coffee Decaffeinated House Blend,  K-Cup Portion Pack for Keurig K-Cup Brewers, 12 Count"
"B00DB55FVA","Wonderful Pistachios, Sweet Chili, 1.25 Ounce (Pack of 12)"
"B00DETOTNI","Nestle Coffee-mate Liquid Creamer Original 3-pack;50 Count Each."
"B00DOR2AQ8","Honey Smacks Cereal, 15.3 Ounce Box"
"B00DPE21ZU","WILLIAMS Spicy Wings Seasoned Coating Mix - 5 Oz (6-Pack)"
"B00E0C685A","Plum Organics Baby Second Blends Fruit and Grain, Pumpkin/Dates/Oats/Chia, 3.5 Ounce (Pack of 12)"
"B00EN0ZLK2","Big Bob Gibson Bar-B-Q Seasoning and Dry Rub"
"B00F99HMTE","Simply Organic Enchilada Sauce Seasoning Mix, 1.41 Ounce (Pack of 12)"
"B00FDM5UVY","Honey Stinger Kids Chews, Sour Citrus, 0.8 Ounce (Pack of 5)"
"B00FF0SBX8","Get Crackin! Wonder Pisatchios Salt &amp; Pepper Flavor ~ 8 X 4.5 Oz Bags - 2.25 Lb Box"
"B00FIWCUOO","Mid Pac Sauce, Char Siu, 7 Ounce"
"B00G5MG7OU","Zing Nutrition Bar-Dark ChocolateSunflower Mint-Box Zing Bars 12 Bars 1 Box"
"B00G6KGXAE","Mochiko (Sweet Rice Flour) - 16oz (Pack of 3)"
"B00HKIBDYC","Lotus Foods Organic Rice Ramen Noodles, Jade Pearl Rice, 6 Count"
"B00HMUISSW","Kinnikinnick Gluten Free Soft Dinner Rolls (Pack of 3) Each Pack 8oz"
"B00HRIDJL0","Belvita Cinnamon Brown Sugar Breakfast Biscuits Mega Pack - (25 Packs of 4) - 44 oz Total"
"B00IVT3ZHW","Back To Nature Cookies, Chocolate Chunk, 9.5 Ounce"
"B00KRFLDR2","Nutiva O'Coconut Hemp and Chia Organic Superfood, 24 Count"
"B00KRFLH8C","Nutiva O'Coconut Classic Snack, 24 Count"
